{
  "attestation": {
    "approval_authority": false,
    "completion_authority": false,
    "external_effect_authority": false,
    "local_filesystem_only": true,
    "provider_native_authority": false,
    "state_write_authority": false
  },
  "benchmark_id": "m9-06-obsidian-vault",
  "gate": {
    "failed_gates": [],
    "status": "passed"
  },
  "generated_at": "2026-08-17T23:59:00+08:00",
  "latency_ms": {
    "max": 1.059245,
    "p50": 0.49354,
    "p95": 0.7598
  },
  "latency_samples_ms": [
    0.659898,
    0.497938,
    0.493029,
    0.494732,
    0.525404,
    0.491944,
    0.46897,
    0.464084,
    0.470761,
    0.508925,
    0.516992,
    0.487021,
    0.480098,
    0.491169,
    0.47799,
    0.517115,
    0.483415,
    0.487457,
    0.474489,
    0.473168,
    0.478421,
    0.529781,
    0.502896,
    0.482721,
    0.483849,
    0.473699,
    0.483462,
    0.499086,
    0.474738,
    0.487571,
    0.489446,
    0.5006,
    0.537356,
    0.477447,
    0.469484,
    0.475839,
    0.48618,
    0.505936,
    0.495793,
    0.62977,
    0.514187,
    0.751577,
    0.479916,
    0.474021,
    0.501894,
    0.526009,
    0.470875,
    0.482098,
    0.464418,
    0.519815,
    0.492811,
    0.500958,
    0.503543,
    0.4734,
    0.490791,
    0.503104,
    0.499738,
    0.654901,
    0.753614,
    0.485997,
    0.47731,
    0.519071,
    0.483787,
    0.480007,
    0.483536,
    0.51409,
    0.494122,
    0.521813,
    0.506531,
    0.479107,
    0.748558,
    0.787986,
    0.525713,
    0.494648,
    0.486609,
    0.473693,
    0.504212,
    0.506712,
    0.506507,
    0.483236,
    0.508695,
    0.486102,
    0.517029,
    0.501485,
    0.475894,
    0.531656,
    0.496004,
    0.487366,
    0.496294,
    0.490035,
    0.484988,
    0.517307,
    0.485883,
    0.474978,
    0.475047,
    0.569071,
    0.478577,
    0.501196,
    0.536324,
    0.519679,
    0.488524,
    0.483276,
    0.461356,
    0.477441,
    0.510901,
    0.500618,
    0.48535,
    0.543394,
    0.487743,
    0.517845,
    0.489274,
    0.476404,
    0.488908,
    0.492455,
    0.679482,
    0.739843,
    0.498762,
    0.48186,
    0.523082,
    0.46905,
    0.479008,
    0.481126,
    0.493449,
    0.527747,
    0.519447,
    0.557871,
    0.540795,
    0.482955,
    0.48853,
    0.485712,
    0.497176,
    0.484555,
    0.49541,
    0.467318,
    0.504677,
    0.496419,
    0.75402,
    0.733761,
    0.784209,
    0.781759,
    0.73753,
    0.752069,
    0.774791,
    0.793399,
    0.746625,
    0.536197,
    0.499703,
    0.613766,
    0.501991,
    0.466528,
    0.555677,
    0.475616,
    0.480426,
    0.49704,
    0.510331,
    0.492349,
    0.486587,
    0.473836,
    0.508858,
    0.51386,
    0.472759,
    0.479718,
    0.465393,
    0.486993,
    0.492987,
    0.508012,
    0.502398,
    0.493598,
    0.49354,
    0.501283,
    0.479291,
    0.471427,
    0.485048,
    0.492749,
    0.609374,
    0.468871,
    0.492449,
    0.560143,
    0.734227,
    0.772211,
    0.7598,
    0.500502,
    0.477738,
    0.52393,
    0.469819,
    0.476069,
    0.488562,
    0.487256,
    0.568788,
    0.495475,
    0.479041,
    0.497768,
    0.485659,
    0.547154,
    0.497864,
    0.497711,
    0.500743,
    0.488662,
    0.51192,
    0.463869,
    0.476217,
    0.481982,
    0.465301,
    0.468135,
    0.472071,
    0.478347,
    0.463737,
    0.487144,
    0.485827,
    0.504195,
    0.475464,
    0.497343,
    0.490456,
    0.489073,
    0.527656,
    0.511011,
    0.495276,
    0.490217,
    0.464849,
    0.482647,
    0.474417,
    0.463135,
    0.597949,
    0.486125,
    0.480167,
    0.501079,
    0.486009,
    0.474967,
    0.487653,
    0.510263,
    0.510309,
    0.480324,
    0.487953,
    0.49882,
    0.519594,
    0.55921,
    0.529739,
    0.482038,
    0.47854,
    0.486915,
    0.515072,
    0.514939,
    0.481754,
    0.477447,
    0.503999,
    0.487894,
    0.511238,
    0.486909,
    0.488893,
    0.589988,
    0.475175,
    0.494694,
    0.494654,
    0.466132,
    0.476467,
    0.495529,
    0.501485,
    0.486353,
    0.477467,
    0.483886,
    0.493702,
    0.48883,
    0.545042,
    0.470745,
    0.470816,
    0.493853,
    0.484824,
    0.535311,
    0.471589,
    0.486469,
    0.521648,
    0.470204,
    0.5005,
    0.467599,
    0.472512,
    0.489528,
    0.504318,
    0.6555,
    0.53418,
    0.493588,
    0.561882,
    0.498622,
    0.471814,
    0.466828,
    0.51424,
    0.476595,
    0.468375,
    0.513872,
    0.4795,
    0.519315,
    0.514584,
    0.479503,
    0.465531,
    0.483047,
    0.506647,
    0.527293,
    0.812918,
    0.773945,
    0.759748,
    0.556051,
    0.50988,
    0.484481,
    0.469613,
    0.52781,
    0.517844,
    0.47569,
    0.476482,
    0.513442,
    0.488605,
    0.507276,
    0.48925,
    0.489918,
    0.465085,
    0.520089,
    0.51074,
    0.488636,
    0.535075,
    0.483414,
    0.482449,
    0.508952,
    0.489144,
    0.48486,
    0.568041,
    0.491063,
    0.483674,
    0.472215,
    0.519172,
    0.775511,
    0.487281,
    0.463199,
    0.47208,
    0.465078,
    0.469492,
    0.466253,
    0.47128,
    0.478302,
    0.488236,
    0.499406,
    0.493537,
    0.478713,
    0.490673,
    0.474949,
    0.52203,
    0.50765,
    0.474079,
    0.483982,
    0.469282,
    0.488875,
    0.562876,
    0.564327,
    0.640827,
    0.491921,
    0.507771,
    0.540293,
    0.500974,
    0.514479,
    0.503931,
    0.477157,
    0.470199,
    0.508546,
    0.51478,
    0.496965,
    0.481188,
    0.494223,
    0.491831,
    0.533184,
    0.476629,
    0.485982,
    0.480963,
    0.496436,
    0.526398,
    0.516465,
    0.486469,
    0.478969,
    0.480499,
    0.518132,
    0.493074,
    0.516706,
    0.479584,
    0.49158,
    0.49238,
    0.483274,
    0.491579,
    0.502277,
    0.476497,
    0.502599,
    0.535745,
    0.524578,
    0.502839,
    0.500079,
    0.493116,
    0.92248,
    0.504145,
    0.486402,
    0.489057,
    0.495684,
    0.49835,
    0.477823,
    0.624273,
    0.506556,
    0.489286,
    0.519512,
    0.480388,
    0.49928,
    0.48017,
    0.491324,
    0.811317,
    0.488099,
    0.472763,
    0.464857,
    0.475144,
    0.488918,
    0.482134,
    0.586055,
    0.567238,
    0.510342,
    0.478228,
    0.479499,
    0.514798,
    0.484041,
    0.495915,
    0.522761,
    0.479475,
    0.479605,
    0.480172,
    0.470963,
    0.507799,
    0.485411,
    0.487557,
    0.488044,
    0.50373,
    0.510521,
    0.465119,
    0.48234,
    0.639105,
    0.492683,
    0.466377,
    0.477518,
    0.466862,
    0.466191,
    0.489467,
    0.487843,
    0.489274,
    0.471725,
    0.487532,
    0.470243,
    0.466594,
    0.491096,
    0.504751,
    0.989156,
    0.969205,
    0.506533,
    0.519991,
    0.512019,
    0.483735,
    0.488829,
    0.45848,
    0.489805,
    0.478515,
    0.492572,
    0.483454,
    0.486794,
    0.483867,
    0.486493,
    0.511548,
    0.524102,
    0.495363,
    0.480821,
    0.471191,
    0.501035,
    0.508582,
    0.774032,
    0.760648,
    0.736091,
    0.790089,
    0.779135,
    0.512689,
    0.525552,
    0.489783,
    0.482052,
    0.525909,
    0.481768,
    0.471365,
    0.73816,
    0.750655,
    0.494942,
    0.499453,
    0.486984,
    0.488719,
    0.517246,
    0.836583,
    0.505473,
    0.50574,
    0.474486,
    0.471764,
    0.505382,
    0.507594,
    0.495721,
    0.490645,
    0.494483,
    0.572973,
    0.493285,
    0.492739,
    0.473091,
    0.490821,
    0.493375,
    0.499343,
    0.517267,
    0.497589,
    0.494896,
    0.776365,
    0.520176,
    0.485692,
    0.481866,
    0.475488,
    0.592599,
    0.516382,
    0.491846,
    0.491908,
    0.515524,
    0.505087,
    0.562275,
    0.520029,
    0.479954,
    0.489278,
    0.486084,
    0.510142,
    0.527226,
    0.469365,
    0.478424,
    0.498568,
    0.490778,
    0.516646,
    0.489437,
    0.485009,
    0.491014,
    0.500341,
    0.518965,
    0.503022,
    0.515446,
    0.495617,
    0.475396,
    0.496186,
    0.489263,
    0.505641,
    0.520002,
    0.487202,
    0.484902,
    0.475375,
    0.486613,
    0.518522,
    0.505687,
    0.479576,
    0.488083,
    0.484404,
    0.4925,
    0.51172,
    0.477687,
    0.49318,
    0.485659,
    0.504892,
    0.521041,
    0.461525,
    0.477529,
    0.476066,
    0.575103,
    0.52903,
    0.519871,
    0.481869,
    0.500657,
    0.485215,
    0.529276,
    0.525335,
    0.4896,
    0.493662,
    0.488564,
    0.500776,
    0.516355,
    0.490418,
    0.476025,
    0.587642,
    0.7322,
    0.742189,
    0.768305,
    0.825646,
    0.772478,
    0.531821,
    0.475041,
    0.475471,
    0.496554,
    0.523904,
    0.53559,
    0.477038,
    0.498181,
    0.481869,
    0.493305,
    0.841139,
    0.971923,
    0.959888,
    0.504336,
    0.527489,
    0.484222,
    0.490273,
    0.481681,
    0.525091,
    0.481257,
    0.487274,
    0.489516,
    0.475186,
    0.539803,
    0.491872,
    0.481972,
    0.463752,
    0.467107,
    0.559531,
    0.55077,
    0.532294,
    0.501136,
    0.481401,
    0.485007,
    0.495824,
    0.492069,
    0.508242,
    0.523687,
    0.478408,
    0.521982,
    0.685623,
    0.466508,
    0.4907,
    0.497277,
    0.484723,
    0.519681,
    0.487055,
    0.463241,
    0.496667,
    0.489413,
    0.488411,
    0.473056,
    0.50856,
    0.499486,
    0.482389,
    0.491191,
    0.490119,
    0.468535,
    0.49854,
    0.53348,
    0.482008,
    0.496994,
    0.490257,
    0.500926,
    0.495717,
    0.480548,
    0.478014,
    0.489229,
    0.47006,
    0.478975,
    0.535896,
    0.499321,
    0.494282,
    0.510601,
    0.524133,
    0.47203,
    0.486405,
    0.504376,
    0.611476,
    0.482919,
    0.571538,
    0.509772,
    0.478903,
    0.475079,
    0.486833,
    0.750694,
    0.742284,
    0.770627,
    0.74124,
    0.843838,
    0.753944,
    0.478794,
    0.481479,
    0.585727,
    0.869206,
    0.511334,
    0.489053,